나레이션,"(인형들은 데레의 회사로 돌아가고, 손상이 심했던 소프는 수리실로 보내진다.)"
나레이션,(리바가 메일함을 닫고 한숨을 쉰다.)
리바,"하…… 골치 아프네. 계약서는 우리가 무사히 빼냈는데, 상대가 증인도 꼼꼼히 준비해 뒀어."
리바,"방금 비군사력관리국에서 통보가 왔는데, 지금 레나랑 우리 셋 모두 불법 거래에 연루된 인형으로 지목됐어."
리바,"오데사 주정부는 증거 부족으로 아직 카리나를 직접 겨냥하지 못하지만, 상사라는 이유로 조사에 협조하라고 되어 있대."
리바,"가만 생각해 보면, 류리크 의원이 일부러 봐줬기 때문에 별장에서 복사를 성공할 수 있었을지도 모르지."
리바,"성격은 급해 보이는데, 사실 노련하게 꿍꿍이를 부리고 있었네……|내가 얕봤어."
리바,"레나랑 카리나는 겨우 위조 식별 코드 혐의를 벗었는데, 이번엔 불법 거래 사건에 휘말렸으니 참 안됐다."
G11?,그게 네가 준비한 대비안 중 하나 아니었어?
리바,"아이구, 미슈티 얼굴로 그렇게 차가운 말 하지 말아줘."
리바,"로벨라도 이해할 거야, 그때 상황이 얼마나 긴급했는지."
리바,"그 계약서를 오데사 주정부가 정말로 발견했다면, 비군사력관리국 고위 참사관이 불법 거래에 가담한 혐의가 기정사실이 됐을 거야."
리바,"그러면 지라드 그룹을 계속 추적하긴커녕, 비군사력관리국이 오데사 주에서 갖는 영향력도 크게 떨어질 거고."
로벨라,"그래서 너는 카리나 이름이 써 있는 계약서를 본 순간, 대비안을 가동해 레나를 희생시키기로 결심한 거야?|난 네가 누구를 포기하더라도 레나만은 위험에 빠뜨리지 않을 줄 알았는데."
리바,……
나레이션,"(리바는 잠시 굳었다가, 다시 웃으며 말한다.)"
리바,원래는 G11 소체를 쓰는 로벨라가 그렇게 무난히 계약서를 들고 나가길 바랐지.|아니었으면 내가 굳이 주변 CCTV나 치안 기계를 계속 해킹해 주진 않았을 거야.
리바,"하지만 그 상황에서 로벨라가 중량 경보기를 발견하더라도, 계약서를 꺼내야 했잖아?"
리바,"그래서 난 치안 쪽 시선을 전부 끌어모으는 방법밖에 없었고, 네가 계약서를 가지고 나갈 수 있게 한 거지."
로벨라,"리바, 너는 이제 임무를 위해 누구든 희생시킬 수 있는 거야?|404를 지키기 위한 행동이라면서, 이렇게 쉽게 레나를 내보내도 돼……"
로벨라,"왜? 예전 네라면, 경전철역에서 바로 전투가 붙더라도 먼저 동료 안전부터 챙겼잖아."
리바,혼잡 시간대에 함부로 총을 쏘면 더 많은 사람이 다치잖아. 우린 이미 그 공감대를 이룬 줄 알았어.
리바,"이번에 큰 사상자가 없었던 건, 치안 쪽에서 기계의 공격을 제한해 놨던 덕분이 크고, 소프가 외부 불법 기계를 제때 막아준 덕분이야. 이게 어제 로벨라가 걱정하던 부분 아니었어?"
로벨라,"지금 상황에서 그게 제일 합리적인 선택이라는 건 나도 알아, 그렇지만——"
리바,"알면 됐잖아, 그럼 너무 고민하지 마.|우리가 그냥 포기하고, 카리나가 잡혀가서 비군사력관리국이 축출당하게 둘 순 없지. 결국 류리크 의원이 임시 수석에 오르는 걸 눈뜨고 지켜볼 거야?"
나레이션,"(리바는 아직 웃고 있지만, 분위기는 별로 좋지 않다. 그녀는 살짝 마인드맵을 가다듬는다.)"
리바,"하지만 로벨라가 이렇게 레나 걱정해 주는 걸 알면, 레나도 엄청 좋아하겠다."
로벨라,……난 그저 내 곁에 있는 친구들이 다 무사하길 바랄 뿐이야.
리바,"걱정 마. 로벨라가 계약서를 이미 무사히 빼냈고, 국장님의 수완을 감안하면 레나, 카리나, 비군사력관리국 전부 아무 문제 없을 거야."
로벨라,정말로요...?
리바,"아니었다면 이 일이 비군사력관리국 내부 공지에서만 그치지 않고, 오늘 밤 ‘오데사 시사’ 뉴스에 터져 나왔을 거야."
리바,"이번에 레나가 억울한 건 사실이지만, 난 이익과 손해를 충분히 따져 봤어. 어차피 이성적 판단을 내리는 게 모든 인형의 장점이잖아."
나레이션,"(로벨라는 리바가 일부러 강조하는 말에 대답하지 않고, 화제를 돌린다.)"
로벨라,"어쨌든 지라드의 함정은 피해 갔지만, 이 단서는 완전히 무효야.|수석이 뭘 남겼든 이젠 다 없애버렸을 거고."
로벨라,"커다란 위험을 감수하고 뛰어들었는데, 얻은 게 없네……"
리바,음~ 그건 또 몰라~
로벨라,뭐라고?
리바,로벨라가 열심히 해준 덕분이기도 하고.
나레이션,"(리바는 그렇게 말하며, 앞에 있던 기기를 ‘G11’에게 건네준다.)"
로벨라,이거…… 내가 찍은 보관함 사진이잖아?
리바,빙고~ 로벨라가 꼼꼼해서 보관함 안 사진을 찍어 뒀지.|방금 내가 손좀 봤어.
로벨라,뭐 특별한 거라도 있어?
나레이션,"(‘G11’은 확대된 이미지를 보고 고개를 갸웃한다. 오래 사용한 탓에 보관함 내부는 온통 녹과 얼룩이 가득하고, 자잘한 소매상들이 붙여 놓은 질 낮은 광고들이 덜 뜯긴 채 남아 있다.)"
리바,"로벨라가 나보다 인간에 더 관심이 많으니, ‘가장 위험한 곳이 가장 안전한 곳’이란 말도 알 거지?"
로벨라,설마…… 여기에……
리바,"난 보관함 안에서 보이는 광고들을 전부 확인해 봤는데, 그중 하나의 URL이 흥미로운 곳으로 이어지더라."
나레이션,(리바가 어떤 페이지를 연다.)
로벨라,토지 증서……?
리바,"정확히는 토지 증서 초안이라, 계약 당사자는 안 보이지만…|토지 위치가 써 있더라. ODE-04에 있어."
로벨라,가볼 생각이야?
리바,"응, 광고 사이에 토지 증서 초안이 끼어 있다는 게 수상하잖아?"
리바,"우리도 전에 보관함 보안성을 의심했었는데, 혹시 수석이 이걸 역으로 활용해서 정보 전달 성공률을 높이려 했을 수도 있지."
리바,"어차피 당분간 오데사로 돌아갈 수도 없고, 카리나도 명령이나 정보를 보내지 못하니까, 차라리 이 새 단서를 따라가 보는 게 낫잖아. 전부 대기하는 것보다는."
로벨라,"내 마인드맵 연산 결과로는, 확률이 낮긴 해……"
리바,오? 이제 와서 일반 인형처럼 확률 계산 타령이야?
로벨라,내가 계산 안 한다고 한 적 없거든. 다만 전략 선택이 다를 뿐이야.
리바,"그럼, 로벨라 이번엔 뭘 선택할 건데?"
로벨라,간다.
로벨라,"……알아둬, AR소대가 지금까지 버텨온 확률이 이것보다 훨씬 더 낮았다고."
리바,"하하, 방금 데레가 연락해 왔어. 소프 수리가 끝났다고 하네. 이제 가서 소체 교체하면 돼~|아니면 로벨라가 벌써 ‘G11’ 소체를 못 떠나겠어?"
나레이션,"('G11'은 장난스럽게 구는 리바를 흘끔 보고, 일어나서 수리실로 간다.)"
나레이션,"(망설이다가, 결국 문을 나서기 전에 솔직히 한 마디를 던진다——)"
로벨라,디너게이트만도 못하군.
