로벨라,보아하니 그 경력을 얘기하고 싶지 않은 것 같더군요.
로벨라,전에는 그 과거를 떠올리기 싫어서인 줄 알았는데…|동료 분 얘기를 들으니 제 추측이 틀린 듯해요.
P.M.C. 구성원,"어이, 파벨, 또 수다 떨고 있냐? 네 그 예전 군 생활 썰을 인형한테까지 자랑이냐?"
파벨,윽...
로벨라,그리고 특수 성격 부대를 제외하면… 보통 퇴역 군인은 정부 배치를 받아 화이트·그린존에서 일자리를 얻거든요. 체면은 없어도 생계는 유지하죠.
로벨라,그냥 개인적 호기심입니다. 답하기 싫으시면 괜찮아요.
파벨,"하, 로벨라 양이 알아챘으니 숨기진 않죠."
파벨,사실… 저는 탈영병이에요……
로벨라,탈영병?
파벨,"네, 고, 고의로 도망친 건 아니에요! 그때 소규모 전투에서 있던 참호가 포격당했고 저는 기절했거든요."
파벨,정신 차려 보니 건축 잔해에 깔려 있었고 주변은 시체뿐… 전장 정리하던 동료들도 절 못 본 거죠… 그때 부대는 이미 멀리 갔고요.
파벨,"처, 처음엔 복귀해야겠다 생각했어요! 근데 기어나오다 다리에 걸려 엎어졌는데… 그때 알리나가 떠올랐죠."
로벨라,알리나? 그땐 아직 안 태어났을 텐데?
파벨,"딸 말고, 제 아내요. 아내 이름도 알리나예요.|아… 그땐 아직 아내가 아니었죠… 뭐, 어쨌든 그때 우린 서로 마음이 있었어요."
파벨,"전에 속인 거 없어요. 행군 중 마을을 지나며 만났는데, 제 아내가 거기서 제일 예쁜 아가씨였죠."
파벨,"우리에게 빵을 나눠 주고 노래도 불러 줬는데, 다들 좋아했지만 저한테만 잼 한 병을 몰래 주더라구요……"
나레이션,（파벨은 아내를 떠올리며 얼굴이 붉어졌다.）
파벨,"부대가 떠난 뒤에도 쭉 연락했어요. 전쟁 중이라 통신은 어렵지만, 주둔이 길면 편지를 썼죠. 여건 되면 그녀도 답장을 줬는데, 글씨가 정말 예뻐요……"
나레이션,（로벨라는 카리나를 흘끗 보며 상대가 끼어들 생각 없음을 확인했다.）
파벨,"그 전투 전에 한동안 편지를 못 받아서요. 지난 편지가 못 갔는지, 다른 사람에게 시집가는 건지, 아니면 그 마을이……"
파벨,"다행히 기우였지만, 그때부터 제 생각이 좀 달라졌던 것 같아요……"
파벨,"어쨌든 그 넘어짐에 머리가 복잡해져서, 정신 차리니 전장을 떠나 부대 진행 방향과 반대로 미친 듯이 달리고 있더라구요…|나라의 영예, 국민의 안전보다 알리나랑 결혼하는 게 더 소중했죠."
로벨라,가족들은 알고 있나요?
파벨,"몰라요. 그 마을 사람들은 군 규칙도 모르니까. 전 공을 세워 상관이 조기 귀향을 시켜줬다 했고, 다들 믿었죠."
로벨라,그 뒤에 추궁한 사람도 없었나요?
파벨,"전쟁 중 실종자는 너무 많으니, 상관도 제가 죽었다고 생각했겠죠? 그렇게 넘어갔어요.|그 후엔 군 경력을 좀 부풀리고 인맥 좀 써서 가족 전부 위성 도시 거주권을 땄죠."
파벨,그래도 퇴역 군인 배치는 신청 못 했어요… 진짜로 영광스럽게 돌아온 사람들 보면 부럽긴 해도 후회하진 않아요.
파벨,"아무것도 없을 땐 의욕만으로 전장에 갔지만, 소중한 사람이 생기니 사람이 살아 있어야 의미가 있다는 걸 알았죠.|제가 원하는 평온한 날들은 끝까지 살아서 알리나랑 같이 있어야 성립되는 거예요."
로벨라,......
나레이션,（파벨의 말은 로벨라의 마인드맵에 공명을 일으켰다. 그녀는 이 감정을 포착해 이해하려 애썼다. 아마 자신의 몇몇 혼란과 망설임을 풀 실마리가 될지도 모른다.）
나레이션,（침묵하는 로벨라를 보고 파벨은 오해했다.）
파벨,"로벨라 양, 화내지 마세요."
파벨,"여러분은 어쨌든 정부 기관 사람이잖아요… 탈영병 처벌은 크기도 작은 것도 아니고, 일 늘리고 싶지 않아 숨긴 건데…|설마 지금 와서 절 군사 법정에 넘기려는 건 아니죠?"
로벨라,카리나……
카리나,"이건 이미 성립되지 않아요. 공소시효가 지났고, 최근 부대 개편으로 추궁 주체도 불분명하거든요."
파벨,그렇다니 안심이 되네요.
카리나,"하지만 파벨 씨, 법적 '용서'가 곧 절대적 '정당'은 아니에요."
카리나,"저는 탈영을 인정하지도, 당신 동료나 부대를 대신해 용서할 권한도 없어요."
파벨,압니다… 저도… 그런 생각은…
파벨,（파벨은 머쓱해하며 고개를 떨궜다.）
카리나,하지만 그렇다고 당신을 완전히 부정할 수도 없어요.
파벨,응?
카리나,"파벨 씨, 저도 직접 전쟁을 겪었습니다… 전쟁불길이 저와 소중한 이를 갈라놓을 때 저 역시 뼛속까지 무서웠어요."
카리나,"그 두려움을 안고 전장을 하루, 아니 한 시간 버티는 게 얼마나 힘든지 이해합니다."
카리나,"저에게 전쟁은 잔혹했고, 모든 것을 평등하게 짓밟았죠. 입대는 순간의 결정이지만, 피비린내 나는 전장을 목격하고 부대에서 보낸 매 순간은 진짜 용기였어요."
카리나,"당신의 도피를 인정할 순 없지만, 전장에서 감당한 위험과 노력까지 부정하진 않겠습니다."
파벨,......
카리나,전시 부대가 탈영병을 엄하게 처벌하는 건 질서와 작전 수행을 보장하기 위해서라는 걸 알고 계시겠죠.
카리나,하지만 전쟁은 본래 더 많은 이에게 오래된 평화를 쟁취하기 위한 잔인한 수단이니까요.
카리나,이미 평화 시대니 이 일을 일부러 공개하진 않을 겁니다……
카리나,"하지만 앞으로의 모든 순간, 당신의 행동이 이 법과 시대가 준 ‘용서’에 부끄럽지 않도록 해 주세요."
파벨,"알겠습니다… 감사합니다, 카리나 여사님. 이런 말씀 해 주셔서."
나레이션,（파벨은 눈가가 붉어지며 잠시 머뭇거리다 다시 입을 열었다.）
파벨,"저… 문득 생각난 게 있는데, 조사에 도움이 될 수도 있어요. 잠깐만 기다려 주실래요?"
카리나,응.
나레이션,（파벨은 코를 훌쩍이며 방을 나갔다.）
나레이션,（잠시 후 문이 다시 열리자 파벨이 작은 꾸러미를 안고 몰래 들어왔다.）
파벨,"돌아왔어요, 들킬 뻔했네요!"
파벨,바로 이거예요.
나레이션,（파벨은 꾸러미를 책상 위에 놓고 펼쳤다.）
로벨라,이건… 백신?!
파벨,네… 전에 몰래 아껴 둔 거예요. 얼마 전 마지막 접종하던 그 배치죠.|장기 임무랑 겹쳐서 회사가 챙겨 줬거든요.
로벨라,이걸 어떻게 남겼죠?
파벨,백신이 정규 루트가 아니다 보니 접종 절차도 느슨하죠… 이 주사 3일 미루고 다음 건 보름 미루면 남잖아요.|계속 이렇게 했지만 문제 없었어요……
로벨라,팔려고 한 건가요?
파벨,그럴 리가요. 그냥 집에 비상용으로 둔 거예요. 혹시 모르니까요.
파벨,"이번엔 가족에게 주기도 전에 ODE-07로 끌려왔어요. 원래 계속 숨기려 했죠…|그, 백신 지급 기록이 남아 있으니 사장이 알면 곤란하잖아요……"
나레이션,（파벨은 여러 번 숨긴 걸 떠올려 머쓱해했다.）
파벨,하지만 두 분을 믿습니다.
파벨,방금 말씀으로 보아 이 백신은 단순 불량이 아닐 수도 있죠?|이런 해로운 물건 만드는 자들은 반드시 잡아야 해요!
카리나,"도움 주셔서 고마워요, 파벨 씨."
파벨,별 말씀을요. 그럼 전 이만 가 볼게요. 동료가 의심해서 사장한테 알리면 큰일이라……
나레이션,（말을 마친 파벨은 다시 방을 떠났다.）
카리나,"로벨라, 네 덕분에 아주 중요한 단서를 얻었어. 목표를 좁히면 조사 시간을 많이 아낄 수 있어."
로벨라,우연히 발견했을 뿐이에요.
카리나,겸손할 것 없어. 로벨라 네가 아니었다면 파벨 씨는 입도 열지 않았을 거야. 걱정이 많았으니까.
로벨라,하지만 결국 파벨 씨가 솔직해진 건 카리나의 대답 때문이라고 생각해요.
카리나,내 대답?
로벨라,"응, 파벨 씨가 전장에 참여했다가 도망친 일에 대한 대답 말이야."
로벨라,그는 복잡한 심경이야. 그 과거를 어떻게 마주해야 할지 모르겠는 듯해……
로벨라,네 답변이 그를 움직였어. 아니었으면 백신을 내놓지 않았겠지.
로벨라,"이번 일로 더욱 확신이 들었어… 카리나, 너 페르시카가 원래의 3세대 인형 설계를 뒤엎은 얘기 알지?"
카리나,음?
나레이션,（로벨라의 갑작스런 화제 전환에 카리나는 당황했다.）
카리나,알고 있어… 당시 페르시카의 3세대 인형 기술이 유출돼 연구 방향을 바꿨지.
카리나,레나한테도 들었어. 자기가 실험 인형으로 새 연구에 참여했다고.|외부 요인이 없었어도 페르시카가 자기 설계를 뒤엎은 건 한두 번이 아니잖아. 로벨라도 도왔었지?
로벨라,"응, 한때 개조 성공자로 판정되기도 했어… 페르시카의 도움과 인도로 내 소망을 깨달았고, 인형의 족쇄에서 벗어나 진심으로 선택했지."
로벨라,하지만 나중에 페르시카는 내가 그녀가 원한 3세대 인형이 아니라고 했어. 설계·개조를 맡은 리코는 성공했지만 자신은 아직… 기술이 안 털렸어도 계획은 다 엎었을 거라고.|나는 리코의 ‘3세대 인형’로서 자유롭게 살 수 있대.
카리나,페르시카가 이유를 설명했어?
로벨라,"응. 인간 같은 인형만으론 자기가 바라는 3세대가 아니래. 페르시카를 도울 수 없었던 건 아쉽지만, 난 그때나 지금이나 내 마음의 변화를 기쁘게 여겨."
로벨라,오늘 밤 경험으로 더 확신했어… 인간의 감성은 약점이면서도 기회야. 나 포함 모든 인형이 고민해야 할 요소지.
카리나,......
나레이션,（로벨라의 말을 들은 카리나는 놀라움을 감추지 못했다. 인형과 인간의 경계가 희미해지는 듯했다.）
나레이션,"（로벨라는 아직 미숙하지만, 배워 가고 있었다. 그 자체로 인간에 더 가까워졌다.）"
카리나,"아, 리코가 세상을 떠났고 페르시카도 로벨라를 더는 프로토타입으로 삼지 않으니 아쉽네…|그랬으면 인간과 인형의 협력 방식이 달라졌을지도 모르는데."
로벨라,카리나는 그런 걸 기대해?
카리나,"나? 물론이지. 나한텐 너희가 부하이자 친구야, 빈말이 아니고.|그리고 지휘나 임무 없이 그냥 너희랑 수다 떨고 쇼핑하는 날을 더 기대해."
로벨라,음… 그때까지는 상관으로 있어 줘.
나레이션,（로벨라의 진지한 모습에 카리나는 웃음을 터뜨렸다.）
카리나,"시간이 없어, 그럼 상관인 내가 명령을 내릴게."
카리나,"로벨라, 파벨 씨가 준 백신의 생산 번호랑 제조사 정보를 나한테 보내고, 얻은 정보는 리바 쪽에 동기화해 줘. 이후 연락을 기다려."
로벨라,응.
