나레이션,(수오미는 지휘실에서 나와 중앙 구역으로 천천히 걸어가며 고민스러운 듯 머리를 긁적였다.)
수오미,역시 지휘관님을 속일 수 없네. 음... '메이링 씨의 고민 해결 임무뿐만 아니라 '네메시스 씨의 보고서 정리'까지 맡아버렸네. 내가 제대로 할 수 있을까 걱정이야...
수오미,"아냐 아냐, 아직 시작도 안 했는데 벌써 기죽으면 안 돼! 지휘관님 말씀대로 먼저 용기를 내서 첫걸음을 내디뎌야 해!"
수오미,"단말기에 새로운 메시지는 없네, 네메시스 씨가 돌아오려면 약 50분 남았네. 그렇다면... 우선 메이링 씨의 고민부터 시작해 봐야겠어. 내 소체도 수리해 주셨으니까, 나도 도움이 되면 좋을 텐데..."
수오미,"...맞다, 그로자 대장이 가시기 전에 주의 사항을 적어 주셨는데, 어디 있지... 찾았다!|'메이링, 엔지니어. 좋아하는 것: 쌀술, 블록 쌓기 게임.' 이, 이게 다야?"
나레이션,"(아무리 화면을 눌러봐도 이 두 마디 뿐, 추가 정보는 없었다. 수오미는 허탈하게 한숨을 내쉬었다.)"
수오미,"...어쨌든 우선 메이링 씨의 고민이 무엇인지 알아야겠어. 그러려면 처음엔 먼저 자연스럽게 인사하는 것부터 시작해야겠지... 이따가 함께 물자를 점검할 테니, 그 기회를 활용해서 거리를 좁혀봐야겠어..."
수오미,검색... 사람들이 인사할 때 자주 사용하는 말... 검색 완료... 검색 결과가 21개 있네.
나레이션,"(수오미는 한 손을 들어 올려, 메이링을 만나는 상황을 상상하며 손을 흔들고, 어색하게 입꼬리를 끌어올려 미소를 지어 보였다.)"
수오미,"하, 하이. 메이링 씨, 배고프지 않으신가요?|...메이링 씨의 고향에서 자주 사용하는 인사말이라는데 좀 이상한 것 같네... 다른 걸로 하자."
수오미,"하이, 메이링 씨. 오늘은 날씨가 참 좋네요!|...아냐, 오염지대는 1년 내내 황사인데, 전혀 좋은 날씨라고 할 수 없잖아... 이것도 안 되겠어..."
??,"T430... T430 부품이 어디 갔지? 지난번, 이 상자에 뒀었는데... 어, 어라, 왜 없지?"
수오미,"메, 메이링씨? 물자 점검까지 27분 남았는데, 왜 여기에 있는 거지...|큰일이야... 인사할 타이밍을 놓쳐버렸어... 어떻게 해야 하지? 일단 숨는 게 좋을까?"
나레이션,"(메이링은 중앙 구역에 다른 사람이 있는 걸 전혀 눈치채지 못한 채, 익숙한 듯 물자 상자를 하나씩 확인하고 있었다.)"
메이링,"여기에도 없네... 이건? 아, 이따가 점검할 물자구나!|이, 이 상자는... 쌀술이 8병이나 있잖아! 어?? 지휘관님이... 몰래 이렇게 많이 사셨다고?"
메이링,"음, 지휘관님 대신 귀하게 잘 보관해 둬야지~! 이렇게 많은 쌀술은 오랜만이야."
메이링,읏차!|음... 그렇게 무겁지도 않은 것 같네.
나레이션,(메이링이 안도의 한숨을 쉬며 쌀술 상자를 들어 올리고 비틀거리며 걸어갔다.)
메이링,...으악!
수오미,조심해!
나레이션,"(메이링이 발을 헛디디는 순간, 수오미는 생각할 겨를도 없이 재빠르게 튀어나와 어려운 자세로 메이링을 받아냈다. 덕분에 쌀술도 깨지지 않고 구할 수 있었다.)"
수오미,"...메이링 씨, 괜찮으세요?"
메이링,"아, 수, 수오미씨? 다행이에요, 엄청 큰일 날 뻔했네요... 도와주셔서 고마워요!|제, 제 쌀술은 괜찮아요? 혹시 다 쏟아졌다고 말하지 마요... 으으...."
수오미,"걱정하지 마세요. 전부 멀쩡해요. 우리 이제 일어나는 게 좋겠어요, 바닥이 차가워요..."
메이링,아! 미안해요...
나레이션,"(둘은 각자 바닥에서 일어나, 어색한 표정으로 서로를 쳐다보고 잠시 침묵했다)"
수오미,"무, 무슨 이야기를 해야 하지...|저기, 메이링 씨, 배고프지 않으신가요?"
메이링,"네? 저, 저 배부르게 먹었어요...|수오미, 인사를 하고 싶은 거예요? 음, 보통 배고픈지 물어보는 게 아니라, 식사는 하셨냐고 물어보는 거예요."
수오미,그랬구나...
나레이션,(수오미는 주저하지 않고 마인드맵에서 인사말 관련 정보를 삭제했다.)
수오미,"이러면 안 돼, 뭔가 대화를 이어야 하는데... 메이링 씨의 고민을 해결하는 임무도 있잖아."
수오미,"메이링 씨, 쌀술을 어디로 옮기실 건가요? 제가 도와드릴게요."
메이링,"아녜요, 미안하게... 제가 하면 돼요.|이것 봐요, 혼자서도 들 수 있어요!"
나레이션,"(메이링이 수오미에게 자신의 근육을 보여주려 소매를 걷어붙이고 팔을 구부렸지만, 근육은 생각만큼 부풀어 오르지 않았다.)"
메이링,아... 음...
수오미,...역시 제가 도와드릴게요.
나레이션,"(수오미와 메이링은 함께 쪼그리고 앉아 쌀술 상자를 다시 정리했다. 얼굴이 빨갛게 달아오른 메이링이 수오미와 눈이 마주쳤고, 두 사람은 웃음을 터뜨렸다.)"
메이링,"...미안해요, 센 척하다 들켰네요.|그리고 쌀술을 '훔치는' 것도 보셨죠. 지휘관님이 쌀술을 숨겨두지 말라고 그렇게 말씀하셨는데..."
수오미,"괜찮아요, 지휘관님께 말씀드리지 않을게요."
메이링,정말요? 다행이다! 든든한 수오미 대장 만세!|아... 어어...
나레이션,(메이링은 갑자기 일어서는 바람에 몸이 휘청거렸다.)
수오미,"메이링 씨, 괜찮으세요?"
메이링,"괜찮아요, 갑자기 일어나서 잠깐 어지러웠을 뿐이에요. 요즘 잠을 좀 늦게 자서 그런가 봐요... 으으, 조금만 더 부축해 주실 수 있나요? ...다리에 쥐가 나서..."
수오미,네! 괜찮으세요? 잠깐 앉아서 쉬세요...
나레이션,(메이링이 수오미의 부축을 받아 벽에 기대어 앉았다.)
메이링,수오미의 옷은 두껍고 부드럽네요. 마치 베개 같아서... 뭔가... 잠이 와요...
수오미,기지차량 정비로 고생 많으셨어요. 피곤하면 잠시 기대서 쉬세요.
메이링,별거 아니에요. 저번에 시생물 토벌 때문에 기지차량이 심하게 파손돼서 정비해야 했거든요.|아.... 또 갑자기 엔진이 멈추면 '엘모호 수석 엔지니어'라는 내 명예에 금이 가는데...
메이링,음... 그리고... 요즘 밤마다 이상한 소리가 들려서요...
수오미,어떤 소리인가요?
나레이션,"(귓가에 메이링의 얕은 숨소리가 들려와 고개를 돌려 보니 메이링은 이미 눈을 감은 채, 수오미의 어깨에 기대어 잠들어 있었다.)"
수오미,메이링 씨...? 정말 피곤하셨나 보네...
수오미,"아, 고민이 뭔지 아직 못 물어봤는데."
