나레이션,"(심상치 않은 분위기를 자아내는 어슴푸레한 조명 아래, 넓지 않은 공간에서 나는 드셰브니를 마주 보면서 서 있었다.)"
마을사람(드셰브니),이건 정말 예상하지 못한 일인데...
마을사람(드셰브니),"정말 나를 선택하신 겁니까?|분명 다른 강하고 똑똑한 분들도 많을 텐데... 제가 일을 망쳐버릴지도 모르는데, 괜찮으신 겁니까?"
영주(지휘관),"아니, 내 생각엔 네가 딱 맞는다고 생각하는데. 이번 임무엔 네가 적격이야."
마을사람(드셰브니),"음... 다르다!|지휘관, 조금 더... 좀 더 역할에 몰입해서!"
나레이션,(드셰브니는 가슴에 감은 시트를 움켜쥐고 뾰로통하게 볼을 부풀렸다.)
나레이션,(나는 지팡이 삼아 들고 있던 대걸레를 바라보며 머리를 긁적였다.)
영주(지휘관),"몰입...이라지만, 영주는 도대체 어떤 말투로 말해야 하는 건데? 현상금 사냥꾼 연기라면 잘할 자신 있는데."
마을사람(드셰브니),"영주라면 이렇게 말해야 한다! ""그대야말로 예언서에 적힌 분, 그대가 바로 우리가 그토록 찾아 헤매던 용사님인 모양이군!"" 이런 식으로!"
나레이션,"(나는 침을 꿀꺽 삼킨 뒤, 입 밖으로 꺼내기 부끄러운 대사를 어렵게 읊었다.)"
영주(지휘관),그대가 바로 우리가 그토록 찾아 헤매던 용사님인 모양이군.
마을사람(드셰브니),영주님의 믿음은 마치 심해 속에 비치는 한 줄기 빛처럼 어둠뿐이었던 제 인생을 밝혀주셨어요.
마을사람(드셰브니),그렇다면 반드시 그 믿음을 저버리지 않겠어요!
영주(지휘관),"굳이 그렇게까지 자기 인생을 어둡다고 말할 필요는...|아무튼, 출발하자고!"
나레이션,(이야기가 슬슬 막바지에 다다른 것 같아 나는 안도의 한숨을 내쉬었다.)
마을사람(드셰브니),"지휘관, 아직 의식이 남아있다! 아까 처음에 말했던 기사 작위 수여식!"
영주(지휘관),어? 아... 그거 말이지... 그거 진짜 해야 해...?
나레이션,"(나는 들고 있던 대걸레를 바라보다가, 그 끝으로 최대한 살살 드셰브니의 머리를 툭 하고 건드렸다.)"
나레이션,('깡' 소리와 함께 드셰브니 머리 위의 귀가 살짝 움직였다.)
드셰브니,음...
지휘관,어때?
나레이션,(드셰브니가 얼굴을 잔뜩 찌푸렸다.)
드셰브니,"...내, 내 마인드맵 기록 섹터는 여전히 불모지 상태란 말이다!"
드셰브니,혹시 의식이 잘못된 거 아닌가? 참고한 자료가 너무 모호했던 것인가...
지휘관,의식이 큰 영향을 주진 않았을 거야.
나레이션,"(나는 숙소 조명을 켠 뒤, 대걸레를 옆에 두고 침대에 앉아 옆자리에 있는 시트를 툭툭 두드리며 드셰브니에게 앉으라는 신호를 보냈다.)"
나레이션,(드셰브니는 어깨에 걸친 시트를 휙 벗어던지며 씩씩거렸다. 인조 피부로 덮이지 않은 소체가 조명 아래서 희미하게 빛나고 있었다. 드셰브니는 침대에 앉으며 무거운 한숨을 내쉬었다.)
드셰브니,"하아... 과거 장면을 재현해보면 무언가 떠오를 것 같았는데...|용사 이야기들에선 다 그렇게 나오지 않나? 비슷한 상황을 다시 겪으면 잠들어 있던 기억이 되살아나는, 그런..."
지휘관,"음, 과거의 나는 널 대걸레로 때린 적 없을 텐데."
드셰브니,"그, 그건 각색한 것 뿐이니까!"
드셰브니,"분명 나라면 마인드맵에서 현실을 살짝 각색했을 것 같은데...현실이랑은 다를 수도 있지만, 내 기억에 맞춰서 재현했으면 분명 더 잘 떠올라야 하는데!"
나레이션,"(드셰브니가 베개 밑에 얼굴을 파묻자, 삐죽 튀어나온 동물 귀가 축 늘어졌다. 그 모습은 마치 강아지같았다.)"
드셰브니,"수오미의 음악 치료도, 네메시스의 명상도 전부 시도해봤지만... 하지만 전부 소용없었다..."
드셰브니,어떡하지... 잃어버린 시간의 파편을 찾으려면 대체 어떻게 해야 한단 말인지...
나레이션,"(나조차도 시간이 지나면, 선명했던 기억이 색이 바래져 가며 마치 남의 기억처럼 느껴질 때가 있다.)"
나레이션,(기억을 완전히 잃어버린 드셰브니가 느낄 불안은 짐작조차 할 수 없다.)
나레이션,(나는 그녀의 귀를 가만히 쓰다듬었다.)
지휘관,"너무 조급해하지 마, 드셰브니."
지휘관,"네가 떠나고 난 뒤에 그리폰에 있던 네 마인드맵 백업은 삭제됐지만, 네가 그리폰을 나간 뒤에 갔던 회사를 찾으면 마인드맵 백업이나 단서 정도는 찾을 수 있을 거야."
나레이션,(동물 귀가 쫑긋 세워지더니 이쪽을 향했다.)
드셰브니,지휘관... 혹시 나 대신 그리폰 쪽에 물어봐 준 건가?
지휘관,"응, 상강 소대를 통해서 그리폰의 책임자 헬리안 씨에게 물어봤지. 곧 소식이 올 거야."
드셰브니,헬리안... 그 사람도 내가 아는 사람이었을까?
나레이션,(드셰브니는 고개를 들고 멍한 눈빛으로 나를 바라보았다.)
지휘관,오래 전부터 있던 사람이야. 나도 꽤 신세를 많이 졌었지.
드셰브니,음... 지휘관에게 뭐라고 감사의 인사를 해야 할지 모르겠다.
드셰브니,"기억을 되찾는 일 뿐만 아니라, 지휘관과 다시 만나고 나서 잃어버렸던 나의 빛나는 과거와 다시 이어지는 기분이다. 드디어... 드디어 정처 없이 떠도는 떠돌이가 아니게 된 것 같다!"
나레이션,(어깨에 기댄 드셰브니의 부드러운 귀 끝이 내 볼을 스쳤다.)
드셰브니,좋다... 이렇게 그대의 옆에 있으면 마치 한겨울 밤 모닥불 옆에 앉아있는 기분이 드는군.
지휘관,엘모호는 항상 온도가 일정하게 유지되잖아. 굳이 모닥불까지는 필요 없지 않을까?
드셰브니,"지휘관은 정말 분위기라는 걸 모르는군. 지휘관과 있으면 음, 느낌이, 음, 따뜻하다는 말을 하는 거다..."
나레이션,(드셰브니가 갑자기 말을 멈췄다.)
지휘관,왜 그러니?
드셰브니,지휘관은 마치...
지휘관,뭐라고?
드셰브니,"윽, 헤헤. 비밀이다!"
지휘관,......
드셰브니,"이제 그건 됐다, 지휘관! 다음 장면을 연기해 보자!"
나레이션,(갑작스러운 화제 전환에 나는 방금 느꼈던 감정 변화를 어떻게 받아들여야 할지 몰랐다.)
지휘관,또 하려고? 소용없다고 하지 않았어?
드셰브니,그래도 혹시 이번엔 성공할 수도 있지 않나!
드셰브니,이번에는 내가 주군의 충직한 기사가 되어서 주군인 그대를 지키기 위해 모든 걸 건다는 설정으로!
나레이션,"(내 머리가 대략 멍해진 사이, 어느새 드셰브니는 시트를 두른 채로 강아지처럼 초롱초롱한 눈빛을 보내고 있었다.)"
나레이션,(나는 결국 조용히 옆에 뒀던 대걸레를 주워 들었다.)
